{
  "schema_version": "1.0.0",
  "source_id": "uav-sead",
  "source_version": "774a336a1d1d06b248927a35c2ea1f6869e9e1a4",
  "authorized_at": "2026-09-25T00:00:00Z",
  "authorized_by": "repository-owner-phase-c-request",
  "purpose": "phase_c_parser_and_inventory_pilot",
  "limits": {
    "maximum_flights": 5,
    "maximum_download_bytes": 536870912,
    "bulk_download_allowed": false
  },
  "registry_checks": {
    "license_reviewed": true,
    "provenance_reviewed": true,
    "privacy_plan_reviewed": true
  },
  "status": "authorized",
  "notes": "Metadata state was public and ungated at review. Authorization covers five revision-pinned ULog files for local parser, inventory, integrity, schema, privacy, and duplicate checks only."
}
