{
  "schema_version": "1.0.0",
  "source_id": "uav-sead",
  "source_version": "774a336a1d1d06b248927a35c2ea1f6869e9e1a4",
  "authorized_at": "2026-09-27T02:00:00Z",
  "authorized_by": "repository-owner-phase-c-continuation",
  "purpose": "phase_c_parser_and_inventory_pilot",
  "limits": {
    "maximum_flights": 5,
    "maximum_download_bytes": 12627139,
    "bulk_download_allowed": false
  },
  "registry_checks": {
    "license_reviewed": true,
    "provenance_reviewed": true,
    "privacy_plan_reviewed": true
  },
  "status": "authorized",
  "proposal": {
    "path": "ml/acquisition/plans/uav-sead-batch-004-proposal.json",
    "sha256": "a17cb0b61cfa143abdeef5201b9134e853faafd85dc05052841fc3491873a6e2",
    "candidate_count": 5
  },
  "notes": "Authorization is limited to the five neutral candidates bound by proposal checksum. Permitted work is local acquisition, inventory, parsing, privacy checks, canonical conversion, label validation, and feature-quality reporting. Training and evaluation remain prohibited."
}
