{
  "schema_version": "1.0.0",
  "source_id": "uav-sead",
  "source_version": "774a336a1d1d06b248927a35c2ea1f6869e9e1a4",
  "authorized_at": "2026-09-27T11:31:00Z",
  "authorized_by": "repository-owner-experiment-2-request",
  "purpose": "phase_c_parser_and_inventory_pilot",
  "limits": {
    "maximum_flights": 5,
    "maximum_download_bytes": 37686247,
    "bulk_download_allowed": false
  },
  "registry_checks": {
    "license_reviewed": true,
    "provenance_reviewed": true,
    "privacy_plan_reviewed": true
  },
  "status": "authorized",
  "proposal": {
    "path": "ml/acquisition/plans/uav-sead-batch-031-proposal.json",
    "sha256": "b96aba68030704bb444f94b715ad1b040edcba69555b9e585df34a41982f7388",
    "candidate_count": 5
  },
  "notes": "Fresh Experiment 2 test-cohort acquisition only. Training and evaluation prohibited until the cohort is frozen."
}
